<?xml version="1.0" encoding="UTF-8"?>
<!DOCTYPE nbpcg PUBLIC "-//uk/theretiredprogrammer/nbpcg/DTD NBPCG SCHEMA 1.0//EN"
"nbres:/uk/theretiredprogrammer/nbpcg/nbpcg.dtd" >

<nbpcg name="?">
    
    <build viewerroles="?">
        <project name="?" log="?.?.?">
            <generatescripts/>
            <generate type="?" package="p.p.p" />
        </project>
    </build>
    
    <node name="x">
        
    </node>
    
    <databases>
        <database name="?">
            <table name="?">
                <field name="?"/>
                <insert values="?" />
            </table>
        </database>
    </databases>
</nbpcg>
