<?xml version="1.0" encoding="UTF-8"?>
<!DOCTYPE nbpcg PUBLIC "-//uk/org/rlinsdale/nbpcg/DTD NBPCG SCHEMA 1.0//EN"
    "nbres:/uk/org/rlinsdale/nbpcg/nbpcg.dtd" >

<nbpcg name="a" >
    
    <build >
        <project name="p" log="l">
            <generate type="z" package="p.p.p" />
        </project>
    </build>
    
    <node name="x" icon="y" rooticon="z" >
        
    </node>
    
    <databases>
        <database name="x" >
            <table name="x">
                <field name="x"/>
                <insert values="z" />
            </table>
        </standard>
    </databases>
</nbpcg>
